media_key,tmdb_id,media_type,title,original_title,overview,release_date,first_air_date,last_air_date,year,rating,vote_count,popularity,budget,revenue,runtime,number_of_seasons,number_of_episodes,episode_run_time,genres,language,origin_country,status,tv_type,networks,production_companies,adult,poster_local,trailer_youtube,trailer_embed
movie_1311031,1311031,movie,Истребитель демонов: Бесконечный замок,劇場版「鬼滅の刃」無限城編 第一章 猗窩座再来,"Во время подготовки к решающему сражению с демонами члены Корпуса и столпы проходят изнурительную программу — Тренировку Хашира. Но внезапно сам Музан Кибуцудзи появляется в особняке Убуяшики. Когда глава Корпуса оказывается в смертельной опасности, Танджиро и Хашира спешат на помощь, но Музан втягивает их в таинственное пространство — замок Бесконечности, логово демонов. Так начинается финальное сражение между охотниками на демонов и силами зла.",2025-07-18,,,2025,7.715,865,99.4283,20000000,733030221,155,0,0,,"мультфильм, боевик, фэнтези",ja,JP,Released,,,"ufotable, Aniplex, Shueisha",False,anime_posters/movie_1311031.jpg,,
movie_1218925,1218925,movie,Человек-бензопила. Фильм: История Резе,劇場版 チェンソーマン レゼ篇,"Молодой охотник на демонов Дэндзи, который ждал свидания со своей возлюбленной Макимой, попадает под ливень. Укрывшись от дождя, он случайно встречает девушку по имени Резе, работающую в соседнем кафе. Та добродушно ему улыбается, и разговор становится более непринужденным. После этой встречи повседневная жизнь Дэндзи начинает меняться.",2025-09-19,,,2025,8.416,938,25.7741,4100000,191400000,100,0,0,,"мультфильм, боевик, мелодрама, фэнтези",ja,JP,Released,,,MAPPA,False,anime_posters/movie_1218925.jpg,,
movie_1244492,1244492,movie,Оглянись,ルックバック,"Ученица четвёртого класса Фудзино рисует короткие комиксы для школьной газеты. Взрослые и одноклассники хвалят её талант, но однажды она встречает соперницу — одноклассницу Кёмото, которая, хоть и не посещает школу, тоже рисует для той же газеты. Поражённая уровнем мастерства Кёмото и пытаясь угнаться за ней, Фудзино бросает все силы на то, чтобы научиться лучше рисовать.",2024-06-28,,,2024,8.1,565,9.0035,0,12648664,62,0,0,,"мультфильм, драма",ja,JP,Released,,,"Studio Durian, avex pictures, Shueisha",False,anime_posters/movie_1244492.jpg,,
movie_508883,508883,movie,Мальчик и птица,君たちはどう生きるか,"Через три года после начала Тихоокеанской войны мама мальчика Махито погибла при пожаре в Токио, а ещё через год отец женился на её сестре и отправил сына в фамильное поместье в сельской местности. Глава семьи работает на оборонном заводе и редко бывает дома, поэтому мальчику приходится проводить дни с беременной мачехой и в окружении пожилой прислуги, и, кроме того, с самого первого дня его донимает подозрительная серая цапля. Однажды птица говорит Махито, что может отвести его к матери, и заманивает в загадочную башню, которую окружает множество местных легенд.",2023-07-14,,,2023,7.402,2646,16.4211,50000000,294200000,124,0,0,,"мультфильм, фэнтези, драма",ja,JP,Released,,,Studio Ghibli,False,anime_posters/movie_508883.jpg,https://www.youtube.com/watch?v=6pU47lfTge4,https://www.youtube.com/embed/6pU47lfTge4
movie_1062807,1062807,movie,Семья шпиона – Код: Белый,劇場版 SPY×FAMILY CODE: White,"Мастерский шпион с кодовым именем «Сумрак» проводит свои дни в закулисных миссиях, всё ради мечты о лучшем мире. Но однажды он получает особенно сложное новое указание от командования. Для этой миссии он обязательно должен завести фиктивную семью и начать новую жизнь! Шпионская экшен-комедия об единственной в своём роде семье!",2023-12-22,,,2023,7.156,645,4.4515,5000000,59629242,110,0,0,,"мультфильм, комедия, приключения, боевик",ja,JP,Released,,,"WIT STUDIO, CloverWorks, TOHO, Shueisha, TV Tokyo, Shogakukan-Shueisha Productions",False,anime_posters/movie_1062807.jpg,,
movie_1083862,1083862,movie,Обитель Зла: Остров Смерти,バイオハザード：デスアイランド,"Агент Министерства обороны Леон С. Кеннеди отправляется на задание по спасению доктора Антонио Тейлора от похитителей, но таинственная женщина мешает его преследованию. Тем временем агент B.S.A.A. Крис Редфилд расследует вспышку зомби в Сан-Франциско, причину которой не удаётся установить. Единственное, что объединяет жертв, это то, что все они недавно посещали остров Алькатрас. Следуя этой подсказке, Крис и его команда отправляются на остров, где их ждёт новый ужас.",2023-06-22,,,2023,7.266,1117,3.889,0,53929,87,0,0,,"боевик, мультфильм, фантастика, ужасы",ja,JP,Released,,,"Capcom, Quebico, Sony Pictures, Sammy, Robot Communications, KADOKAWA, TMS Entertainment",False,anime_posters/movie_1083862.jpg,,
movie_916224,916224,movie,"Судзумэ, закрывающая двери",すずめの戸締まり,"16-летняя Судзумэ живёт в тихом городке на острове Кюсю. Однажды по дороге в школу она встречает молодого путешественника, который спрашивает, где в окрестностях находятся развалины. Любопытство берёт верх, и девушка решает посмотреть, что же там такого интересного — пробирается на местную заброшку, находит там загадочную дверь, открывает её и вытаскивает из земли странный камень. Вскоре из открытой двери выбирается гигантская сущность и провоцирует землетрясение. Теперь Судзумэ вместе с тем самым незнакомцем, внезапно обращенным в детский стульчик, приходится отправиться в погоню за вредным говорящим котиком, чтобы закрыть открывающиеся по всей стране двери и предотвратить новые разрушения.",2022-11-11,,,2022,7.889,1749,14.8213,13000000,314992206,121,0,0,,"мультфильм, драма, приключения, фэнтези",ja,JP,Released,,,"CoMix Wave Films, Story, Lawson Entertainment, jeki, voque ting, KADOKAWA, Aniplex, TOHO",False,anime_posters/movie_916224.jpg,,
movie_610150,610150,movie,Драконий жемчуг: Супер — супергерой,ドラゴンボール超 スーパーヒーロー,"Сорок один год назад на планете Вегета, родине печально известной расы сайянских воинов, король Вегета заметил ребенка по имени Броли, чья скрытая сила превосходила силу его собственного сына. Полагая, что сила Броли однажды превзойдет силу его ребенка, Вегеты, король отправляет Броли на пустынную планету Вампа. Спустя годы на Земле Гокуу Сон и принц Вегета - считающиеся последними выжившими представителями расы Сайян - заняты тренировками на отдаленном острове. Но их спарринг прерывается, когда появление их старого врага Фризы заставляет их искать последний из исполняющих желания Шаров Дракона на замерзшем континенте. Оказавшись там, Фриза демонстрирует своих новых союзников: Парагуса и теперь чрезвычайно могущественного Броли. Легендарная битва, сотрясающая основы мира, начинается, когда Гокуу и Вегета сталкиваются с Броли, бесподобным воином, ярость которого только и ждет, чтобы его развязать.",2022-06-11,,,2022,7.888,3032,4.9287,0,86600000,100,0,0,,"мультфильм, фантастика, боевик",ja,JP,Released,,,"Toei Animation, Shueisha, Fuji Television Network, Bandai Namco Entertainment, Toei Company, Bandai, Bandai Spirits",False,anime_posters/movie_610150.jpg,,
movie_900667,900667,movie,Ван-Пис: Красный,ONE PIECE FILM RED,"Пираты Соломенной шляпы встречают певицу Уту, чей голос и песни покорили мир. Девушка готовится к первому концерту, когда вдруг выясняется, что она — дочь капитана Шанкса.",2022-08-06,,,2022,7.215,1129,4.8637,0,171315305,115,0,0,,"мультфильм, приключения, боевик, фэнтези",ja,JP,Released,,,"Toei Animation, Shueisha, Toei Company, Fuji Television Network, Bandai, Bandai Namco Entertainment, ADK Emotions, dentsu",False,anime_posters/movie_900667.jpg,https://www.youtube.com/watch?v=KfaG1ZFjJCg,https://www.youtube.com/embed/KfaG1ZFjJCg
movie_783675,783675,movie,Коронный бросок. Фильм,THE FIRST SLAM DUNK,"Ханамичи Сакураги - хулиган, у которого долгое время не ладилось с девушками. Поступив в старшую школу Сёхоку, Ханамичи заинтересовался девушкой по имени Харуко, которая любит баскетбол.",2022-12-03,,,2022,7.771,536,2.5437,0,258000000,124,0,0,,"мультфильм, комедия, драма",ja,JP,Released,,,"Toei Animation, Toei Company, DandeLion Animation Studio",False,anime_posters/movie_783675.jpg,,
movie_810693,810693,movie,Магическая битва 0. Фильм,劇場版 呪術廻戦 0,"Юту Оккоцу преследует призрак его подруги детства, которая погибла в ДТП. Однако она вовсе не та милая девушка, какой была Рика до смерти, а чудовищное и могущественное существо. Не в силах контролировать агрессивное поведение Рики, Юта бессилен остановить кровопролитие, которое следует за ее жестокой местью. Поэтому, когда его хватают маги, владеющие джиу-джицу, Юта только рад, что больше никто не пострадает. Задержавший его мастер Сатору Годзё заставляет юношу поступить в старшую школу джиу-джицу, чтобы научиться управлять Рикой и помогать людям. Однако вскоре Юта узнает, что злые духи — не самое опасное, что есть в мире.",2021-12-24,,,2021,8.104,1766,11.1218,0,195870885,105,0,0,,"мультфильм, боевик, фэнтези",ja,JP,Released,,,"MAPPA, Shueisha, Sumzap, MBS, TOHO",False,anime_posters/movie_810693.jpg,,
movie_283566,283566,movie,Евангелион: 3.0+1.01: Как-то раз,シン・エヴァンゲリオン劇場版:||,"Воздушный флот организации WILLE успешно проводит парижскую операцию: отбивается от армии беспилотных роботов, активирует гигантский уплотнительный столб, восстанавливает город и заполучает боеприпасы и запчасти «Евангелионов». А в это время потерявший волю к жизни из-за смерти Каору и чуть было не устроенного им самим Четвёртого удара Синдзи вместе с Рэй послушно следует за Аской, и вскоре троица оказывается в Третьей деревне — восстановленном поселении, где люди пытаются наладить мирную жизнь.",2021-03-08,,,2021,8.2,952,5.2188,29700000,93882453,155,0,0,,"мультфильм, боевик, фантастика, драма",ja,JP,Released,,,khara,False,anime_posters/movie_283566.jpg,https://www.youtube.com/watch?v=I8pfTA229gg,https://www.youtube.com/embed/I8pfTA229gg
movie_768744,768744,movie,Моя геройская академия. Фильм 3: Миссия мировых героев,僕のヒーローアカデミア THE MOVIE ワールド ヒーローズ ミッション,"Существуют люди, обладающие сверхъестественными способностями — причудами. Однако не все считают это благословлением. Ведь, если верить теории Судного дня, через некоторое время наступит миг, когда уже никто не сможет контролировать эти сверхъестественные силы, а значит, всё человечество вымрет. Поэтому загадочная организация Humalize во главе с Флектом Терном решает сделать всё, чтобы остановить распространение причуд. Они создают устройство, которое заставляет людей с причудами терять контроль и умирать. Тем временем Деку учится в Отеоне у самого сильного героя, когда его обвиняют в преступлении, которого он не совершал. Парень пускается в бега вместе со своим случайным попутчиком — местным жителем Родди Соулом. Теперь Роди, Деку и его одноклассники должны уничтожить устройство, запущенное Флектом, и не допустить гибели людей с причудами.",2021-08-06,,,2021,7.59,628,3.6631,0,46940541,105,0,0,,"мультфильм, боевик, приключения, фантастика",ja,JP,Released,,,"BONES, TOHO, Yomiuri Telecasting Corporation, Shueisha, Nippon Television Network Corporation, dentsu, Sony Music Entertainment (Japan), movic",False,anime_posters/movie_768744.jpg,,
movie_776305,776305,movie,Красавица и дракон,竜とそばかすの姫,"17-летняя старшеклассница Судзу воспитывается отцом и никак не может смириться с ранней смертью матери. Так как вдвоём с мамой они очень любили петь, с тех пор Судзу забросила пение, но стала писать песни. Девушка решает, что в виртуальном пространстве U, где обитает 5 миллиардов пользователей, она станет другой личностью, и создаёт полную свою противоположность — красавицу-певицу по имени Белль. В этой новой реальности девушка быстро становится популярной и обретает миллионы поклонников. Однажды её виртуальный концерт срывает загадочный пользователь в виде дракона, и Судзу решает узнать, кто же он на самом деле.",2021-07-16,,,2021,7.611,885,2.8992,0,63501160,121,0,0,,"мультфильм, фантастика, фэнтези",ja,JP,Released,,,"Studio Chizu, Nippon Television Network Corporation, dentsu, TOHO, KADOKAWA, Hakuhodo DY Media Partners, Yomiuri Telecasting Corporation, BookWalker, NTT Docomo, Lawson Entertainment, Yomiuri Shimbun Company, movic",False,anime_posters/movie_776305.jpg,https://www.youtube.com/watch?v=eHXBEBOcROY,https://www.youtube.com/embed/eHXBEBOcROY
movie_843241,843241,movie,Семь смертных грехов: Проклятые светом,劇場版 七つの大罪 光に呪われし者たち,"Прошло полгода с тех пор, как группа отважных рыцарей, олицетворяющих семь Смертных Грехов, одолели Короля Демонов, чем обеспечили мир и процветание в королевстве. Лидер воинов Мелиодас, обладающий драконьим грехом гнева, завоевал руку и сердце Элизабет Лионесс, юной наследницы престола, которой сделал предложение выйти замуж, но сначала оба отправляются в романтическое путешествие по стране. Когда над королевством нависает очередная смертельная угроза, главный герой вновь призывает на помощь своих товарищей.",2021-07-02,,,2021,7.706,514,2.6668,0,1094673,80,0,0,,"мультфильм, фэнтези",ja,JP,Released,,,Studio Deen,False,anime_posters/movie_843241.jpg,,
movie_635302,635302,movie,Истребитель демонов: Поезд «Бесконечный»,劇場版「鬼滅の刃」無限列車編,"Тандзиро с друзьями из отряда уничтожителей демонов расследует серию загадочных исчезновений внутри мчащегося поезда. Но компания ещё не знает, что в составе находится один из двенадцати Лунных демонов, и он приготовил для них ловушку.",2020-10-16,,,2020,8.216,4542,10.1806,15700000,523542183,117,0,0,,"мультфильм, боевик, фэнтези",ja,JP,Released,,,"ufotable, Aniplex, Shueisha, TOHO",False,anime_posters/movie_635302.jpg,https://www.youtube.com/watch?v=wtE-SW8YDHM,https://www.youtube.com/embed/wtE-SW8YDHM
movie_533514,533514,movie,Вайолет Эвергарден. Фильм,劇場版 ヴァイオレット・エヴァーガーデン,"Её работа — писать письма. Её имя — Вайолет Эвергарден. Прошло несколько лет, с тех пор как закончилась война, которая нанесла многим глубокие раны. Мир постепенно обретает покой, люди возвращаются к привычной жизни. Вайолет пытается научиться жить без самого важного для нее человека, но однажды она получает письмо, и в её груди вновь разгорается огонек надежды.",2020-09-18,,,2020,8.298,517,6.5134,0,20339624,140,0,0,,"мультфильм, драма, фэнтези, мелодрама",ja,JP,Released,,,"Kyoto Animation, ABC Animation, Pony Canyon, Bandai Namco Arts, Rakuonsha",False,anime_posters/movie_533514.jpg,,
movie_652837,652837,movie,Её заветное желание,ジョゼと虎と魚たち,"Жозе взяла себе имя героини романа Франсуазы Саган. Девушка прикована к инвалидному креслу и почти всё время проводит за чтением и рисованием. Знакомство и дружба со студентом Цунэо начинает менять её взгляды на жизнь, да и сам парень теперь смотрит на мир по-другому.",2020-12-25,,,2020,8.271,602,5.9763,0,0,99,0,0,,"мультфильм, драма, мелодрама",ja,JP,Released,,,"BONES, KADOKAWA, Shochiku, jeki, TOY'S FACTORY, KDDI, Movie Walker, TBS Radio",False,anime_posters/movie_652837.jpg,https://www.youtube.com/watch?v=5WsLCXp8FH0,https://www.youtube.com/embed/5WsLCXp8FH0
movie_667520,667520,movie,Для тебя я стану кошкой,泣きたい私は猫をかぶる,"Необычная девушка превращается в кошку, чтобы привлечь внимание парня. Но прежде чем она успевает это осознать, граница между человеком и животным начинает размываться.",2020-06-18,,,2020,7.868,1493,3.6523,0,0,104,0,0,,"мультфильм, драма, мелодрама, фэнтези",ja,JP,Released,,,"Studio Colorido, Fuji Television Network, Twin Engine, Fuji Creative Corporation, TOHO, KDDI, KADOKAWA, BS Fuji, Dentsu Meitetsu Communications",False,anime_posters/movie_667520.jpg,,
movie_568160,568160,movie,Дитя погоды,天気の子,"16-летний Ходака Морисима убегает из дома в Токио, где у него сразу кончаются деньги. Мало того, что без документов он не может найти работу, так ещё на улице идёт бесконечный дождь, и небо постоянно затянуто тучами. В отчаянии парень обращается к бывшему попутчику, а тот не только берёт его в свой журнал, пишущий о сверхъестественном, но и предоставляет жильё. Однажды Ходака знакомится с девушкой по имени Хина Амано, которая обладает удивительной способностью разгонять тучи и останавливать дождь.",2019-07-19,,,2019,8.0,2637,5.8143,11100000,192729404,112,0,0,,"мультфильм, драма, фэнтези, мелодрама",ja,JP,Released,,,"CoMix Wave Films, Story, TOHO, KADOKAWA, jeki, Lawson Entertainment, ""Weathering With You"" Film Partners",False,anime_posters/movie_568160.jpg,https://www.youtube.com/watch?v=HqSAQHgYyn0,https://www.youtube.com/embed/HqSAQHgYyn0
