media_key,tmdb_id,media_type,title,original_title,overview,release_date,first_air_date,last_air_date,year,rating,vote_count,popularity,budget,revenue,runtime,number_of_seasons,number_of_episodes,episode_run_time,genres,language,origin_country,status,tv_type,networks,production_companies,adult,poster_local,trailer_youtube,trailer_embed
tv_67075,67075,tv,Моб Психо 100,モブサイコ100,"Духи. Злые духи, добрые духи, духи  пацифисты. Они наполнили этот мир и стали обыденным, как воздух. Только  вот люди с воздухом не сражаются, да воздух и вреда не приносит, а в  этом же мире духи ой как любят бедокурить. Специально для их усмирения  среди людей нашлись те, кто назвали себя Экстрасенсами и по велению руки  изгоняли призраков из мест обитания обычных людей. Таким экстрасенсом и  являлся наш главный герой по прозвищу Моб.

Моба на самом деле зовут Кагеяма Сигэо. Он самый обычный восьмиклассник,  несмотря на то что с раннего детства поднимал вещи в воздух силой мысли  и гнул ложки. Сейчас Моб особо не пользуется своей силой в  повседневности, так как не хочет тревожить одноклассников. По большей  части одну девушку, в которую он влюблен. После школы Моб обучается  контролю своей силы у одного такого же экстрасенса. На самом деле его  учитель самый что ни на есть шарлатан и никакими способностями не  обладает. Просто он нашел перспективного бойца с духами и делает на нем  деньги. Кагеяму это особо не напрягает. Он так и живет, борется с духами  и как всякий подросток пытается разобраться в жизни и найти в ней свой  смысл.",,2016-07-12,2022-12-22,2016,8.5,1313,29.4132,0,0,0,3,37,24,"мультфильм, Боевик и Приключения, комедия, НФ и Фэнтези",ja,JP,Ended,Scripted,Tokyo MX,"BONES, Warner Bros. Japan, THE KLOCKWORX, Hakuhodo DY Music & Pictures, BS Fuji, Shogakukan, Shogakukan-Shueisha Productions",False,anime_posters/tv_67075.jpg,,
tv_65844,65844,tv,Да благословят боги сей расчудесный мир!,この素晴らしい世界に祝福を！,"Кадзума Сато – настоящий затворник, который неожиданно распрощался с жизненной дорогой и оказался в альтернативной реальности. Там он повстречал дерзкую богиню Аква, которая предложила новичку вместо превращения в насекомого воспользоваться уникальным шансом и попасть в игровую вселенную, где необходимо уничтожить Князя Тьмы. Главному герою дали возможность прихватить с собой помощника. Хитрый парнишка выбрал вредную Акву. Руководство ободрило выбор. Новоиспеченные напарники устремились навстречу непредсказуемым приключениям.",,2016-01-14,2024-06-19,2016,8.6,1439,21.4554,0,0,0,3,31,24,"Боевик и Приключения, мультфильм, комедия, НФ и Фэнтези",ja,JP,Returning Series,Scripted,Tokyo MX,"Studio Deen, KADOKAWA, Drive, Sammy, Nippon Columbia, 81 Produce",False,anime_posters/tv_65844.jpg,,
tv_65930,65930,tv,Моя геройская академия,僕のヒーローアカデミア,"Четырнадцатилетний Изуку Мидория рано осознал, что люди не рождаются равными. А пришло это понимание, когда его начали дразнить одноклассники, одаренные особой силой. Несмотря на то, что большинство людей в этом мире рождаются с необычными способностями, Изуку оказался среди тех немногих, кто напрочь их лишен. Однако это не стало помехой для мальчика в стремлении стать таким же легендарным героем, как Всемогущий. Для осуществления мечты Изуку не без помощи своего кумира поступает в самую престижную академию героев Юэй, но на этом, как известно, приключения только начинаются.",,2016-04-03,2025-12-13,2016,8.611,5296,15.3245,0,0,0,8,170,24,"Боевик и Приключения, мультфильм, НФ и Фэнтези",ja,JP,Ended,Scripted,"Nippon TV, MBS, TBS, CBC, YTV, Tulip Television, SBC, FBS, BSN, tys, NBC, Chukyo TV, RNB, HTV, FCT, HBC, STV, RKK, KNB, i-Television, SBS, IBC, BSS, MRO, OBS, TUF, RSK, TUY, tbc, RKB, YBS, KTK, KUTV, NKT, RAB, TVI, MMT, ABS, JRT, TOS, RBC, YBC, UTY, RCC, MRT, ATV, MBC, TSB, TeNY, RNC, NIB, KKT, Daiichi-TV, FBC, RKC, KYT, KRY","BONES, Shueisha, movic, dentsu, Yomiuri Telecasting Corporation, Sony Music Entertainment (Japan), TOHO",False,anime_posters/tv_65930.jpg,,
tv_68129,68129,tv,Юри на льду,ユーリ!!! on ICE,"Юри Кацуки один из самых талантливых фигуристов своего поколения в Японии. Все удивляются его таланту, ведь парень очень трудолюбив и тренируется до изнеможения. Впереди у него большие соревнования, которые очень важны для карьеры Юри, и многие возлагают на него большие надежды. К огромному разочарованию всей страны, наш герой проваливается на соревновании, и решает поставить на своей карьере фигуриста крест. Он полностью подавлен и больше не надеется начать тренировки. Теперь он восстанавливает свои силы, хотя где-то в глубине души надеется исполнить свою мечту, хотя и не представляет с чего начать. Юри знакомится с подопечным Никифорова, которого также зовут Юрий. Вместе со своим новым русским знакомым, Юри приступает к тренировкам и готов снова достичь самых высоких целей.",,2016-10-06,2016-12-22,2016,8.508,657,9.2589,0,0,0,1,12,23,"мультфильм, комедия, драма",ja,JP,Ended,Scripted,tv asahi,"MAPPA, avex pictures, TV Asahi, dentsu, Cygames, TV Asahi Music, movic",False,anime_posters/tv_68129.jpg,,
tv_65249,65249,tv,"Город, в котором меня нет",僕だけがいない街,"Жизнь мангаки нелегка. Тяжелый и кропотливый труд по достоинству вознаграждается в редких случаях. Авторские работы, в которые были вложены душа и нравоучительный посыл, не всегда достигают сердец читателей. Однажды понять, что ты пустой и скучный человек, не способный на большее — самый большой страх в жизни мангаки.

Сатору Фудзинума - тоже автор. В свои 28 он трудится не покладая рук, однако не все авторы гении, и далеко не у каждого получается выразить себя в своих работах. Множеством вопросов ежедневно задается Сатору, и боится однажды увидеть себя пустым и скучным. Но разве пустые и скучные люди могут так же ловко подмечать в своем окружении разные мелочи? Сатору может. Но признавать это в себе, то, что делает его далеко не посредственным, он не хочет. Впрочем, как и называть свой дар сверхъестественным.",,2016-01-08,2016-03-25,2016,8.5,1248,6.9911,0,0,0,1,12,25,"мультфильм, драма, детектив",ja,JP,Ended,Miniseries,"Fuji TV, Iwate Menkoi Television, Sakuranbo TV","A-1 Pictures, Aniplex, Fuji Television Network, KADOKAWA, Kansai Television, Kyoraku Industrial Holdings, dentsu, Lawson, C-One, Christmas Holly, Kanetsu Investment",False,anime_posters/tv_65249.jpg,,
tv_63926,63926,tv,Ванпанчмен,ワンパンマン,"Сайтама — внешне обычный парень, который на самом деле является сильнейшим героем, способным победить любого врага одним ударом. Однако эта всесокрушающая мощь привела его к глубочайшей скуке и экзистенциальному кризису: достойных соперников просто не существует. В мире, наводненном монстрами и злодеями, он скорее ищет острых ощущений и хоть какого-то вызова, чем целенаправленно спасает человечество. Вместе со своим преданным учеником-киборгом Геносом Сайтама противостоит угрозам, часто оставаясь незамеченным или недооцененным. Это уморительная сатира на супергеройские клише, сочетающая зубодробительный экшен с неожиданным юмором и поиском смысла жизни.",,2015-10-05,2025-12-28,2015,8.372,4129,33.488,0,0,0,3,36,24,"мультфильм, комедия, Боевик и Приключения, НФ и Фэнтези",ja,JP,Returning Series,Scripted,"TV Tokyo, TV Aichi, TVQ, TV Osaka, TVh, TSC","Madhouse, J.C.STAFF, Bandai Visual, ADK, jeki, Shueisha, Lantis, Banpresto, Good Smile Company, TV Tokyo, ADK Marketing Solutions, Bandai Spirits, Bandai Namco Music Live, Bandai Namco Filmworks",False,anime_posters/tv_63926.jpg,,
tv_64196,64196,tv,Повелитель,オーバーロード,"Легендарная онлайн-игра «Иггдрасиль» неожиданно закрывается. Желая остаться в любимом мире подольше, игрок, управляющий персонажем по имени Момонга, решает оставаться в игре до полного отключения серверов. Момонга — лич, глава одной из топовых гильдий, представляющих в игре тёмную сторону. В момент отключения сервера он собрал всех своих прислужников в главном зале гильдии, сел на трон и стал ждать неизбежного. Но произошло невероятное: сервер не прервал подключение, игра продолжилась, а Момонга превратился в могущественного волшебника. Неигровые персонажи вдруг начали проявлять человеческие эмоции. Теперь безо всякой помощи, без друзей и без какой-либо информации о происходящем Момонге придётся завоевать этот мир, чтобы найти выход.",,2015-07-07,2022-09-27,2015,8.455,1093,22.0017,0,0,0,4,52,24,"мультфильм, НФ и Фэнтези, Боевик и Приключения",ja,JP,Ended,Scripted,AT-X,"Madhouse, KADOKAWA, Hakuhodo DY Music & Pictures, AT-X, NTT Plala",False,anime_posters/tv_64196.jpg,,
tv_62110,62110,tv,Класс убийц,暗殺教室,"Однажды 70% Луны оказывается уничтожено неизвестным дотоле науке существом. При этом оно заявляет, что если в течение последующего года его никто не убьёт, то оно уничтожит и Землю. Мировой конгресс после ряда попыток потерял все надежды на его убийство. Теперь очередь японских школьников! У учеников особого класса 3-E поставлена единственная задача — убить своего учителя, коим и является то самое существо. Да только каким образом класс, с первого взгляда, обычных не преуспевающих учеников сможет убить неизвестного монстра, физические особенности и способности которого превосходят всё, что известно человечеству? И насколько изощрённые способы убийства самый уникальный класс сможет придумать и реализовать?",,2015-01-10,2016-07-01,2015,8.392,1226,18.5949,0,0,0,2,47,24,"мультфильм, комедия, Боевик и Приключения, НФ и Фэнтези",ja,JP,Ended,Scripted,"Fuji TV, Iwate Menkoi Television","Lerche, BS Fuji, Kansai Television, Fuji Television Network",False,anime_posters/tv_62110.jpg,,
tv_62715,62715,tv,Драконий жемчуг супер,ドラゴンボール超（スーパー）,"Спустя 6 месяцев после победы над Маджином Буу, с помощью Драгон-Боллов, Зет-Воины стирают людям память о Маджине Буу и связанных с ним событиях и начинают жить мирной жизнью. Чи-Чи заставляет Гоку искать работу, а тот, в свою очередь, хочет спокойно тренироваться, чтобы быть готовым к угрозам из вне. Остальные же герои наслаждаются миром и покоем.",,2015-07-05,2018-03-25,2015,8.192,5279,15.6843,0,0,0,1,131,23,"мультфильм, Боевик и Приключения, НФ и Фэнтези",ja,JP,Ended,Scripted,Fuji TV,"Toei Company, Toei Animation, Fuji Television Network, YOMIKO Advertising",False,anime_posters/tv_62715.jpg,,
tv_64706,64706,tv,Школа-тюрьма,監獄学園,"Частная академия Хатимицу в предместьях Токио — самая строгая женская школа в Японии. Вот только контингент местный — не капелла ангелов, на которых смотрит дева Мария, а скорее клубок змей, где официальному школьному Совету с президентом Кэйт активно противостоит подковерный конклав во главе с директорской дочкой Мари. И вот ради оживления школьной рутины в старшие классы Хатимицу впервые в истории зачислили пятерых парней. Отныне для несчастных шаг в сторону — нарушение школьных правил, а прыжок на месте — извращение и провокация!",,2015-07-11,2015-09-26,2015,8.062,740,11.1943,0,0,0,1,12,24,"мультфильм, комедия",ja,JP,Ended,Scripted,Tokyo MX,"J.C.STAFF, EGG FIRM, GENCO, Jumondou, Zero-G",False,anime_posters/tv_64706.jpg,,
tv_63145,63145,tv,Шарлотта,シャーロット,"Действия истории разворачиваются в альтернативной вселенной. В ней у определенного количества подростков в возрасте 12-16 лет появляются разнообразные паранормальные способности. Одним из таких подростков является парень по имени Ю Отосака. Несмотря на наличие сверхспособностей, парень живет обычной школьной жизнью и свои «таланты» на показ не выставляет, пока в один из прекрасных дней не встречает девушку по имени Нао Томори.",,2015-07-05,2015-09-27,2015,8.3,651,9.2826,0,0,0,1,13,24,"мультфильм, драма, НФ и Фэнтези",ja,JP,Ended,Scripted,Tokyo MX,P.A.WORKS,False,anime_posters/tv_63145.jpg,,
tv_62273,62273,tv,Кулинарные поединки Сомы,食戟のソーマ,"Юкихира Сома мечтает стать штатным шеф-поваром в ресторане отца и превзойти своего родителя на профессиональном поприще. Он упорно идет навстречу мечте, но в тот момент, когда средняя школа остается позади, отец, Юкихира Джоичиро, закрывает свое заведение и отправляется на покорение Европы. Казалось бы, все планы рухнули, а стремления оказались напрасными, но Джоичиро, видя упавшего духом сына, предлагает ему пройти проверку на выносливость в элитнейшей школе кулинаров, только 10% учеников которой доживают до выпуска. Удастся ли это Соме?",,2015-04-04,2020-09-26,2015,8.437,825,9.6223,0,0,0,5,86,24,"мультфильм, комедия, драма",ja,JP,Ended,Scripted,"TBS, Tokyo MX, BS11",J.C.STAFF,False,anime_posters/tv_62273.jpg,,
tv_67126,67126,tv,Двуличная сестрёнка Умару!,干物妹! うまるちゃん,"Умару — красивая и популярная 16-летняя девушка, живущая со своим старшим братом Тайхэем. Замечательная сестра с добрым сердцем, интеллигентная отличница, которой восхищается каждый. Но кто бы мог подумать, что у себя дома Умару становится совсем другой? Сон, игры, телевизор, фастфуд, кола — это близкие друзья Умару в домашних условиях, с которыми она всласть развлекается, сгружая бытовые проблемы на брата. При этом девушка так хорошо маскируется, что, когда однажды её одноклассник приходит в гости, то «слегка» удивляется истинной сущности Умару.

Тайхэя всегда беспокоила эта удивительная двуличность Умару, но как можно ненавидеть такую милую и смешную сестрёнку? Правильно — никак!",,2015-07-09,2017-12-24,2015,8.237,686,8.5911,0,0,0,2,24,24,"мультфильм, комедия",ja,JP,Ended,Scripted,ABC TV,Doga Kobo,False,anime_posters/tv_67126.jpg,,
tv_61901,61901,tv,Парад смерти,デス・パレード,"Сейчас вам предстоит сыграть в игру. Что это будет за игра - решит рулетка. Ставкой в игре будет ваша жизнь. После смерти, люди, погибшие одновременно, попадают в Квин Деким, где им предстоит сыграть в игру. Но на самом деле, то, что с ними здесь происходит, это Суд Небесный.",,2015-01-10,2015-03-28,2015,7.961,594,7.4454,0,0,0,1,12,23,"мультфильм, драма, детектив",ja,JP,Ended,Scripted,Nippon TV,"Madhouse, DAX Production, GONZO, VAP, NUT, Nippon Television Network Corporation, Magic Bus",False,anime_posters/tv_61901.jpg,,
tv_62428,62428,tv,Рыцари Зодиака: Золотая душа,聖闘士星矢 黄金魂 -soul of gold-,"Во время схватки с Аидом в подземном царстве мертвых двенадцать Золотых Святых жертвуют своими жизнями, разрушая стену плача, а также предоставляя Сэйе и его друзьям возможность продвигаться дальше. Айолиа и другие Золотые Святые, которые должны были исчезнуть, возвращаются к жизни на Земле, полной света и красот. Перед компанией возникает вопрос: каким же образом они воскресли, хотя должны быть мертвыми? Пока тайна остается нераскрытой, Айолиа впутывается в очередную битву, после чего его космическая сила выходит за пределы. Результатом являются изменения, которые проходят с его Материей Льва.",,2015-04-11,2015-09-26,2015,8.008,767,5.1507,0,0,0,1,13,24,"мультфильм, Боевик и Приключения",ja,JP,Ended,Scripted,Bandai Channel,"Toei Animation, Bridge",False,anime_posters/tv_62428.jpg,,
tv_61374,61374,tv,Токийский Гуль,東京喰種トーキョーグール,"Япония, альтернативная реальность. В этом мире параллельно с людьми существует раса гулей - созданий, стоящих выше людей в пищевой цепи, то есть людоедов. Тем не менее, людям удаётся сосуществовать с ними в относительном мире, однако стычки время от времени случаются. Под такую раздачу попадает обычный школьник Канеки, который становится жертвой могущественной женщины-гуля. Чудом пережив нападение, Канеки узнаёт, что взамен утраченных человеческих органов ему пересадили органы гуля. Кто же он теперь - человек или гуль? Ему предстоит пройти долгий путь самоопределения и найти своё место в мире.",,2014-07-04,2018-12-25,2014,8.264,2535,36.5311,0,0,0,4,48,24,"мультфильм, драма, НФ и Фэнтези",ja,JP,Ended,Scripted,Tokyo MX,"Pierrot, Marvelous, TC Entertainment",False,anime_posters/tv_61374.jpg,,
